{
  "id": "rvw_01M595E3RE5665BT5C9CSG45E9",
  "run_id": "run_01M595E3PW46CM8E297ZKSFSKN",
  "tenant_id": "ten_00000000000000000000000000",
  "status": "open",
  "assigned_to": "chetan",
  "decisions": [],
  "comment": null,
  "version": 1,
  "decided_by": null,
  "decided_at": null,
  "created_at": "2026-10-19T04:06:39.630091Z",
  "updated_at": "2026-10-19T04:06:39.630091Z"
}
